Quantum Computing/Lezione-8.1/Lezione-8.1_content_list.json

[
    {
        "type": "text",
        "text": "17 Lecture 17: Quantum circuits I",
        "text_level": 2,
        "bbox": [
            139,
            121,
            657,
            144
        ],
        "page_idx": 0
    },
    {
        "type": "text",
        "text": "17.1 Rotation operators",
        "text_level": 2,
        "bbox": [
            139,
            159,
            447,
            180
        ],
        "page_idx": 0
    },
    {
        "type": "text",
        "text": "We introduce the operators:",
        "bbox": [
            139,
            187,
            388,
            205
        ],
        "page_idx": 0
    },
    {
        "type": "equation",
        "text": "$$\nR _ {x} (\\theta) \\equiv \\exp (- i \\frac {\\theta}{2} X) = \\cos \\frac {\\theta}{2} I - i \\sin \\frac {\\theta}{2} X = \\left( \\begin{array}{c c} \\cos \\frac {\\theta}{2} & - i \\sin \\frac {\\theta}{2} \\\\ - i \\sin \\frac {\\theta}{2} & \\cos \\frac {\\theta}{2} \\end{array} \\right) (1 7. 1)\n$$",
        "text_format": "latex",
        "bbox": [
            228,
            216,
            855,
            254
        ],
        "page_idx": 0
    },
    {
        "type": "equation",
        "text": "$$\nR _ {y} (\\theta) \\equiv \\exp (- i \\frac {\\theta}{2} Y) = \\cos \\frac {\\theta}{2} I - i \\sin \\frac {\\theta}{2} Y = \\left( \\begin{array}{c c} \\cos \\frac {\\theta}{2} & - \\sin \\frac {\\theta}{2} \\\\ \\sin \\frac {\\theta}{2} & \\cos \\frac {\\theta}{2} \\end{array} \\right) \\tag {17.2}\n$$",
        "text_format": "latex",
        "bbox": [
            228,
            256,
            853,
            293
        ],
        "page_idx": 0
    },
    {
        "type": "equation",
        "text": "$$\nR _ {z} (\\theta) \\equiv \\exp (- i \\frac {\\theta}{2} Z) = \\cos \\frac {\\theta}{2} I - i \\sin \\frac {\\theta}{2} Z = \\left( \\begin{array}{c c} \\exp (- i \\frac {\\theta}{2}) & 0 \\\\ 0 & \\exp (i \\frac {\\theta}{2}) \\end{array} \\right) (1 7. 3)\n$$",
        "text_format": "latex",
        "bbox": [
            228,
            295,
            853,
            334
        ],
        "page_idx": 0
    },
    {
        "type": "text",
        "text": "where the exponential is defined by its Taylor series expansion. Note that even powers of $X , Y , Z$ give the identity, while odd powers reproduce the same Pauli matrices. For example $X ^ { 5 } = X ^ { 3 } = X$ . The rotation operators are unitary operators acting on 1-qubit states. They are called rotation operators because they rotate the qubits on the Bloch sphere, by an angle $\\theta ,$ , respectively around the $x , y , z { \\mathrm { ~ a x e s } }$ . For example",
        "bbox": [
            137,
            344,
            855,
            446
        ],
        "page_idx": 0
    },
    {
        "type": "equation",
        "text": "$$\nR _ {x} (\\theta) | \\vec {r} \\rangle = | \\vec {r} ^ {\\prime} \\rangle , \\quad \\vec {r} ^ {\\prime} = \\mathcal {R} _ {x} (\\theta) \\vec {r} \\tag {17.4}\n$$",
        "text_format": "latex",
        "bbox": [
            357,
            447,
            853,
            465
        ],
        "page_idx": 0
    },
    {
        "type": "text",
        "text": "where $\\mathcal { R } _ { x } ( \\theta )$ acts on the 3-dimensional Bloch vector $\\vec { r }$ by rotating it around the axis x by an angle $\\theta$ (counterclockwise). Thus we have a 1-1 correspondence between operators $R$ on the qubit Hilbert space and geometric rotations $\\mathcal { R }$ in the usual 3-dimensional euclidean space. We now justify eq. (17.4). Consider the qubit <sub>|</sub>0<sub>i</sub>, corresponding to the North pole on the Bloch sphere. Its components in the 2- dimensional vector space of qubit physical states are given by (1, 0). If we act on this vector with the rotation operator $R _ { x } ( \\theta )$ we find:",
        "bbox": [
            137,
            471,
            855,
            592
        ],
        "page_idx": 0
    },
    {
        "type": "equation",
        "text": "$$\nR _ {x} (\\theta) | 0 \\rangle = \\left( \\begin{array}{c c} \\cos {\\frac {\\theta}{2}} & - i \\sin {\\frac {\\theta}{2}} \\\\ - i \\sin {\\frac {\\theta}{2}} & \\cos {\\frac {\\theta}{2}} \\end{array} \\right) \\binom{1}{0} = \\binom{\\cos {\\frac {\\theta}{2}}}{- i \\sin {\\frac {\\theta}{2}}} \\tag {17.5}\n$$",
        "text_format": "latex",
        "bbox": [
            255,
            604,
            855,
            644
        ],
        "page_idx": 0
    },
    {
        "type": "text",
        "text": "The resulting vector corresponds to a rotation of the North pole by an angle ✓ around the x-axis (counterclockwise). Indeed the rotated point on the Bloch sphere corresponds to latitude $\\theta$ and longitude $\\phi = \\textstyle { \\frac { \\pi } { 2 } }$ , and therefore corresponds to the qubit physical state",
        "bbox": [
            137,
            653,
            857,
            722
        ],
        "page_idx": 0
    },
    {
        "type": "equation",
        "text": "$$\n| \\psi \\rangle = \\cos \\frac {\\theta}{2} | 0 \\rangle + e ^ {i \\phi} \\sin \\frac {\\theta}{2} | 1 \\rangle = \\cos \\frac {\\theta}{2} | 0 \\rangle - i \\sin \\frac {\\theta}{2} | 1 \\rangle = \\binom{\\cos \\frac {\\theta}{2}}{- i \\sin \\frac {\\theta}{2}} \\tag {17.6}\n$$",
        "text_format": "latex",
        "bbox": [
            189,
            733,
            853,
            771
        ],
        "page_idx": 0
    },
    {
        "type": "text",
        "text": "which indeed coincides with (17.5).",
        "bbox": [
            139,
            783,
            473,
            801
        ],
        "page_idx": 0
    },
    {
        "type": "text",
        "text": "17.2 Universal set of quantum gates",
        "text_level": 2,
        "bbox": [
            139,
            823,
            591,
            843
        ],
        "page_idx": 0
    },
    {
        "type": "text",
        "text": "Theorem 1: any unitary operation $U$ on n qubits can be realized using only CNOT and single qubit gates.",
        "bbox": [
            137,
            851,
            855,
            885
        ],
        "page_idx": 0
    },
    {
        "type": "page_number",
        "text": "78",
        "bbox": [
            487,
            906,
            509,
            919
        ],
        "page_idx": 0
    },
    {
        "type": "text",
        "text": "Theorem 2: any single qubit gate can be approximated by products of the Hadamard $\\frac { \\pi } { 8 }$ $T$",
        "bbox": [
            137,
            125,
            872,
            162
        ],
        "page_idx": 1
    },
    {
        "type": "text",
        "text": "Thus CNOT, H, $T$ are an universal set for quantum computation.",
        "bbox": [
            139,
            173,
            717,
            191
        ],
        "page_idx": 1
    },
    {
        "type": "text",
        "text": "The proof of these two Theorems can be found in the Lecture Notes on Quantum Computation, or in the standard references on quantum computation. Here we just give an example, the To↵oli gate in terms of CNOT and 1-qubit gates:",
        "bbox": [
            137,
            204,
            857,
            256
        ],
        "page_idx": 1
    },
    {
        "type": "image",
        "img_path": "images/897d799ad498b423ae0c12e18b0acc0c2447dd712e23a03364f7c99de01c41c2.jpg",
        "image_caption": [],
        "image_footnote": [],
        "content": "= T\nH ⊕ T† ⊕ T ⊕ T† ⊕ T H\nT† ⊕ T† ⊕ S",
        "sub_type": "text_image",
        "bbox": [
            169,
            260,
            845,
            372
        ],
        "page_idx": 1
    },
    {
        "type": "text",
        "text": "Note: the phase gate $S$ and the $\\frac { \\pi } { 8 }$ gate $T$ are given by the unitary matrices",
        "bbox": [
            139,
            390,
            794,
            409
        ],
        "page_idx": 1
    },
    {
        "type": "equation",
        "text": "$$\nS = \\left( \\begin{array}{c c} 1 & 0 \\\\ 0 & i \\end{array} \\right), \\quad T = \\left( \\begin{array}{c c} e ^ {- i \\frac {\\pi}{8}} & 0 \\\\ 0 & e ^ {+ i \\frac {\\pi}{8}} \\end{array} \\right) = e ^ {- i \\frac {\\pi}{8} Z} \\tag {17.7}\n$$",
        "text_format": "latex",
        "bbox": [
            289,
            420,
            855,
            461
        ],
        "page_idx": 1
    },
    {
        "type": "page_number",
        "text": "79",
        "bbox": [
            487,
            904,
            509,
            919
        ],
        "page_idx": 1
    }
]

Quantum Computing/Lezione-8.1/Lezione-8.1.md

## 17.1 Rotation operators

$$
R _ {y} (\theta) \equiv \exp (- i \frac {\theta}{2} Y) = \cos \frac {\theta}{2} I - i \sin \frac {\theta}{2} Y = \left( \begin{array}{c c} \cos \frac {\theta}{2} & - \sin \frac {\theta}{2} \\ \sin \frac {\theta}{2} & \cos \frac {\theta}{2} \end{array} \right) \tag {17.2}
$$

$$
R _ {x} (\theta) | \vec {r} \rangle = | \vec {r} ^ {\prime} \rangle , \quad \vec {r} ^ {\prime} = \mathcal {R} _ {x} (\theta) \vec {r} \tag {17.4}
$$

$$
R _ {x} (\theta) | 0 \rangle = \left( \begin{array}{c c} \cos {\frac {\theta}{2}} & - i \sin {\frac {\theta}{2}} \\ - i \sin {\frac {\theta}{2}} & \cos {\frac {\theta}{2}} \end{array} \right) \binom{1}{0} = \binom{\cos {\frac {\theta}{2}}}{- i \sin {\frac {\theta}{2}}} \tag {17.5}
$$

$$
| \psi \rangle = \cos \frac {\theta}{2} | 0 \rangle + e ^ {i \phi} \sin \frac {\theta}{2} | 1 \rangle = \cos \frac {\theta}{2} | 0 \rangle - i \sin \frac {\theta}{2} | 1 \rangle = \binom{\cos \frac {\theta}{2}}{- i \sin \frac {\theta}{2}} \tag {17.6}
$$

## 17.2 Universal set of quantum gates

$$
S = \left( \begin{array}{c c} 1 & 0 \\ 0 & i \end{array} \right), \quad T = \left( \begin{array}{c c} e ^ {- i \frac {\pi}{8}} & 0 \\ 0 & e ^ {+ i \frac {\pi}{8}} \end{array} \right) = e ^ {- i \frac {\pi}{8} Z} \tag {17.7}
$$